{
  "$schema": "https://json-schema.org/draft/2020-12/schema",
  "$id": "ao.atlas.recommendation-checkpoint-readback.v0.1",
  "type": "object",
  "required": [
    "schema",
    "status",
    "mission_id",
    "elapsed_minutes",
    "min_minutes",
    "max_minutes",
    "min_minutes_met",
    "lease_time_status",
    "checkpoint_freshness_status",
    "completed_nodes",
    "ready_nodes",
    "blocked_nodes",
    "failed_nodes",
    "total_nodes",
    "final_response_allowed",
    "final_response_reason",
    "exact_next_action",
    "schedules_work",
    "executes_work",
    "approves_work",
    "claims_authority_advance"
  ],
  "additionalProperties": false,
  "properties": {
    "schema": { "const": "ao.atlas.recommendation-checkpoint-readback.v0.1" },
    "status": { "enum": ["fresh", "blocked"] },
    "mission_id": { "type": "string", "minLength": 1 },
    "evidence_root": { "type": "string" },
    "started_at": { "type": "string" },
    "completed_at": { "type": "string" },
    "elapsed_minutes": { "type": "integer", "minimum": 0 },
    "min_minutes": { "type": "integer", "minimum": 0 },
    "max_minutes": { "type": "integer", "minimum": 0 },
    "min_minutes_met": { "type": "boolean" },
    "lease_time_status": { "type": "string", "minLength": 1 },
    "checkpoint_freshness_status": { "type": "string", "minLength": 1 },
    "completed_nodes": { "type": "integer", "minimum": 0 },
    "ready_nodes": { "type": "integer", "minimum": 0 },
    "blocked_nodes": { "type": "integer", "minimum": 0 },
    "failed_nodes": { "type": "integer", "minimum": 0 },
    "total_nodes": { "type": "integer", "minimum": 1 },
    "first_executable_node": { "type": "string" },
    "final_response_allowed": { "type": "boolean" },
    "final_response_reason": { "type": "string", "minLength": 1 },
    "exact_next_action": { "type": "string", "minLength": 1 },
    "schedules_work": { "const": false },
    "executes_work": { "const": false },
    "approves_work": { "const": false },
    "claims_authority_advance": { "const": false }
  }
}
