{
  "schema": "ao.atlas.recommendation-checkpoint-readback.v0.1",
  "status": "fresh",
  "mission_id": "mission-long-wave",
  "evidence_root": "docs/evidence/ao-atlas-lease-resume-wave-v01",
  "started_at": "2026-07-04T08:34:04-07:00",
  "completed_at": "2026-07-04T11:04:04-07:00",
  "elapsed_minutes": 150,
  "min_minutes": 120,
  "max_minutes": 180,
  "min_minutes_met": true,
  "lease_time_status": "minimum_minutes_met",
  "checkpoint_freshness_status": "elapsed_minutes_recorded_after_node_checkpoint",
  "completed_nodes": 13,
  "ready_nodes": 27,
  "blocked_nodes": 0,
  "failed_nodes": 0,
  "total_nodes": 40,
  "first_executable_node": "mission-recommendation-next-14",
  "final_response_allowed": false,
  "final_response_reason": "ready nodes or exact next actions remain",
  "exact_next_action": "Emit Foundry import for mission-recommendation-next-14 and execute exactly one active node.",
  "schedules_work": false,
  "executes_work": false,
  "approves_work": false,
  "claims_authority_advance": false
}
